{
  "id": "steps-refs-without-labels",
  "description": "A step list whose version, unit, entity and source references carry no labels is accepted, since a step is a fact and the words are joined when a description is served.",
  "schema": "steps",
  "input": [
    {
      "id": "s1",
      "op": "retrieve",
      "input": {
        "id": "spec_4b1f0c2d9e8a7b6c5d4e3f2a1b0c9d8e",
        "content_version": "cv_0f1e2d3c4b5a69788796a5b4c3d2e1f0"
      }
    },
    {
      "id": "s2",
      "op": "retrieve",
      "input": {
        "id": "spec_7a6b5c4d3e2f1a0b9c8d7e6f5a4b3c2d",
        "content_version": "cv_1a2b3c4d5e6f708192a3b4c5d6e7f809"
      }
    },
    {
      "id": "s3",
      "op": "quotient",
      "inputs": {
        "numerator": "s1",
        "denominator": "s2"
      },
      "policy": "quotient_of_intersect_periods",
      "left_out": [
        {
          "reason": "unmatched_key",
          "count": 9,
          "of": "entities"
        }
      ],
      "unit": {
        "numerator": {
          "ref": "USDollar"
        },
        "denominator": {
          "ref": "USDollar"
        }
      }
    },
    {
      "id": "s4",
      "op": "rank",
      "input": "s3",
      "policy": "rank_what_is_present",
      "params": {
        "limit": 1
      },
      "entity_coverage": [
        {
          "entity": {
            "ref": "country/NGA"
          },
          "periods": 15,
          "of": 15
        }
      ],
      "unit": {
        "numerator": {
          "ref": "USDollar"
        },
        "denominator": {
          "ref": "USDollar"
        }
      }
    },
    {
      "id": "m1",
      "op": "choose_source",
      "policy": "facet_default_by_coverage",
      "choice": {
        "chosen": {
          "ref": "provenance/OECDDAC1"
        },
        "others": [
          {
            "ref": "provenance/WorldBankWDI"
          }
        ],
        "ranking": [
          "places_covered"
        ]
      }
    }
  ],
  "expect": "accept"
}
