{
  "id": "steps-at-mint-labels",
  "description": "A version reference whose label was taken at mint carries at_mint true and is accepted.",
  "schema": "steps",
  "input": [
    {
      "id": "s1",
      "op": "retrieve",
      "input": {
        "id": "spec_4b1f0c2d9e8a7b6c5d4e3f2a1b0c9d8e",
        "content_version": "cv_0f1e2d3c4b5a69788796a5b4c3d2e1f0",
        "label": "Gross ODA disbursements",
        "at_mint": true
      }
    }
  ],
  "expect": "accept"
}
