{
  "id": "steps-unknown-op",
  "description": "A step naming an operation the list lacks is accepted.",
  "schema": "steps",
  "input": [
    {
      "id": "s1",
      "op": "retrieve",
      "input": {
        "id": "spec_4b1f0c2d9e8a7b6c5d4e3f2a1b0c9d8e",
        "content_version": "cv_0f1e2d3c4b5a69788796a5b4c3d2e1f0",
        "label": "Gross ODA disbursements"
      }
    },
    {
      "id": "s2",
      "op": "rolling_mean",
      "input": "s1",
      "policy": "rolling_trailing_window",
      "params": {
        "periods": 3
      }
    }
  ],
  "expect": "accept"
}
