{
  "id": "steps-compare-empty-sides",
  "description": "A compare whose sides hold no single-valued role column records an empty map for each, which is valid.",
  "schema": "steps",
  "input": [
    {
      "id": "s1",
      "op": "retrieve",
      "input": {
        "id": "spec_4b1f0c2d9e8a7b6c5d4e3f2a1b0c9d8e",
        "content_version": "cv_0f1e2d3c4b5a69788796a5b4c3d2e1f0",
        "label": "France gross ODA disbursements"
      }
    },
    {
      "id": "s2",
      "op": "retrieve",
      "input": {
        "id": "spec_7c2e1d0f3a4b5c6d7e8f9a0b1c2d3e4f",
        "content_version": "cv_1a2b3c4d5e6f708192a3b4c5d6e7f809",
        "label": "United Kingdom gross ODA disbursements"
      }
    },
    {
      "id": "s3",
      "op": "compare",
      "inputs": {
        "left": "s1",
        "right": "s2"
      },
      "policy": "compare_intersect_periods",
      "stat_var": "0123456789abcdef",
      "sides": {
        "left": {},
        "right": {}
      }
    }
  ],
  "expect": "accept"
}
