{
  "id": "steps-at-count-bound",
  "description": "A list of exactly 64 steps is accepted.",
  "schema": "steps",
  "input": [
    {
      "id": "s0",
      "op": "retrieve",
      "input": {
        "id": "spec_4b1f0c2d9e8a7b6c5d4e3f2a1b0c9d8e",
        "content_version": "cv_0f1e2d3c4b5a69788796a5b4c3d2e1f0",
        "label": "Gross ODA disbursements"
      }
    },
    {
      "id": "s1",
      "op": "filter",
      "input": "s0",
      "policy": "filter_row_value_predicates"
    },
    {
      "id": "s2",
      "op": "filter",
      "input": "s1",
      "policy": "filter_row_value_predicates"
    },
    {
      "id": "s3",
      "op": "filter",
      "input": "s2",
      "policy": "filter_row_value_predicates"
    },
    {
      "id": "s4",
      "op": "filter",
      "input": "s3",
      "policy": "filter_row_value_predicates"
    },
    {
      "id": "s5",
      "op": "filter",
      "input": "s4",
      "policy": "filter_row_value_predicates"
    },
    {
      "id": "s6",
      "op": "filter",
      "input": "s5",
      "policy": "filter_row_value_predicates"
    },
    {
      "id": "s7",
      "op": "filter",
      "input": "s6",
      "policy": "filter_row_value_predicates"
    },
    {
      "id": "s8",
      "op": "filter",
      "input": "s7",
      "policy": "filter_row_value_predicates"
    },
    {
      "id": "s9",
      "op": "filter",
      "input": "s8",
      "policy": "filter_row_value_predicates"
    },
    {
      "id": "s10",
      "op": "filter",
      "input": "s9",
      "policy": "filter_row_value_predicates"
    },
    {
      "id": "s11",
      "op": "filter",
      "input": "s10",
      "policy": "filter_row_value_predicates"
    },
    {
      "id": "s12",
      "op": "filter",
      "input": "s11",
      "policy": "filter_row_value_predicates"
    },
    {
      "id": "s13",
      "op": "filter",
      "input": "s12",
      "policy": "filter_row_value_predicates"
    },
    {
      "id": "s14",
      "op": "filter",
      "input": "s13",
      "policy": "filter_row_value_predicates"
    },
    {
      "id": "s15",
      "op": "filter",
      "input": "s14",
      "policy": "filter_row_value_predicates"
    },
    {
      "id": "s16",
      "op": "filter",
      "input": "s15",
      "policy": "filter_row_value_predicates"
    },
    {
      "id": "s17",
      "op": "filter",
      "input": "s16",
      "policy": "filter_row_value_predicates"
    },
    {
      "id": "s18",
      "op": "filter",
      "input": "s17",
      "policy": "filter_row_value_predicates"
    },
    {
      "id": "s19",
      "op": "filter",
      "input": "s18",
      "policy": "filter_row_value_predicates"
    },
    {
      "id": "s20",
      "op": "filter",
      "input": "s19",
      "policy": "filter_row_value_predicates"
    },
    {
      "id": "s21",
      "op": "filter",
      "input": "s20",
      "policy": "filter_row_value_predicates"
    },
    {
      "id": "s22",
      "op": "filter",
      "input": "s21",
      "policy": "filter_row_value_predicates"
    },
    {
      "id": "s23",
      "op": "filter",
      "input": "s22",
      "policy": "filter_row_value_predicates"
    },
    {
      "id": "s24",
      "op": "filter",
      "input": "s23",
      "policy": "filter_row_value_predicates"
    },
    {
      "id": "s25",
      "op": "filter",
      "input": "s24",
      "policy": "filter_row_value_predicates"
    },
    {
      "id": "s26",
      "op": "filter",
      "input": "s25",
      "policy": "filter_row_value_predicates"
    },
    {
      "id": "s27",
      "op": "filter",
      "input": "s26",
      "policy": "filter_row_value_predicates"
    },
    {
      "id": "s28",
      "op": "filter",
      "input": "s27",
      "policy": "filter_row_value_predicates"
    },
    {
      "id": "s29",
      "op": "filter",
      "input": "s28",
      "policy": "filter_row_value_predicates"
    },
    {
      "id": "s30",
      "op": "filter",
      "input": "s29",
      "policy": "filter_row_value_predicates"
    },
    {
      "id": "s31",
      "op": "filter",
      "input": "s30",
      "policy": "filter_row_value_predicates"
    },
    {
      "id": "s32",
      "op": "filter",
      "input": "s31",
      "policy": "filter_row_value_predicates"
    },
    {
      "id": "s33",
      "op": "filter",
      "input": "s32",
      "policy": "filter_row_value_predicates"
    },
    {
      "id": "s34",
      "op": "filter",
      "input": "s33",
      "policy": "filter_row_value_predicates"
    },
    {
      "id": "s35",
      "op": "filter",
      "input": "s34",
      "policy": "filter_row_value_predicates"
    },
    {
      "id": "s36",
      "op": "filter",
      "input": "s35",
      "policy": "filter_row_value_predicates"
    },
    {
      "id": "s37",
      "op": "filter",
      "input": "s36",
      "policy": "filter_row_value_predicates"
    },
    {
      "id": "s38",
      "op": "filter",
      "input": "s37",
      "policy": "filter_row_value_predicates"
    },
    {
      "id": "s39",
      "op": "filter",
      "input": "s38",
      "policy": "filter_row_value_predicates"
    },
    {
      "id": "s40",
      "op": "filter",
      "input": "s39",
      "policy": "filter_row_value_predicates"
    },
    {
      "id": "s41",
      "op": "filter",
      "input": "s40",
      "policy": "filter_row_value_predicates"
    },
    {
      "id": "s42",
      "op": "filter",
      "input": "s41",
      "policy": "filter_row_value_predicates"
    },
    {
      "id": "s43",
      "op": "filter",
      "input": "s42",
      "policy": "filter_row_value_predicates"
    },
    {
      "id": "s44",
      "op": "filter",
      "input": "s43",
      "policy": "filter_row_value_predicates"
    },
    {
      "id": "s45",
      "op": "filter",
      "input": "s44",
      "policy": "filter_row_value_predicates"
    },
    {
      "id": "s46",
      "op": "filter",
      "input": "s45",
      "policy": "filter_row_value_predicates"
    },
    {
      "id": "s47",
      "op": "filter",
      "input": "s46",
      "policy": "filter_row_value_predicates"
    },
    {
      "id": "s48",
      "op": "filter",
      "input": "s47",
      "policy": "filter_row_value_predicates"
    },
    {
      "id": "s49",
      "op": "filter",
      "input": "s48",
      "policy": "filter_row_value_predicates"
    },
    {
      "id": "s50",
      "op": "filter",
      "input": "s49",
      "policy": "filter_row_value_predicates"
    },
    {
      "id": "s51",
      "op": "filter",
      "input": "s50",
      "policy": "filter_row_value_predicates"
    },
    {
      "id": "s52",
      "op": "filter",
      "input": "s51",
      "policy": "filter_row_value_predicates"
    },
    {
      "id": "s53",
      "op": "filter",
      "input": "s52",
      "policy": "filter_row_value_predicates"
    },
    {
      "id": "s54",
      "op": "filter",
      "input": "s53",
      "policy": "filter_row_value_predicates"
    },
    {
      "id": "s55",
      "op": "filter",
      "input": "s54",
      "policy": "filter_row_value_predicates"
    },
    {
      "id": "s56",
      "op": "filter",
      "input": "s55",
      "policy": "filter_row_value_predicates"
    },
    {
      "id": "s57",
      "op": "filter",
      "input": "s56",
      "policy": "filter_row_value_predicates"
    },
    {
      "id": "s58",
      "op": "filter",
      "input": "s57",
      "policy": "filter_row_value_predicates"
    },
    {
      "id": "s59",
      "op": "filter",
      "input": "s58",
      "policy": "filter_row_value_predicates"
    },
    {
      "id": "s60",
      "op": "filter",
      "input": "s59",
      "policy": "filter_row_value_predicates"
    },
    {
      "id": "s61",
      "op": "filter",
      "input": "s60",
      "policy": "filter_row_value_predicates"
    },
    {
      "id": "s62",
      "op": "filter",
      "input": "s61",
      "policy": "filter_row_value_predicates"
    },
    {
      "id": "s63",
      "op": "filter",
      "input": "s62",
      "policy": "filter_row_value_predicates"
    }
  ],
  "expect": "accept"
}
