{
  "id": "steps-inputs-name-versions",
  "description": "A step whose role inputs are versions, one of them an ops_ version, is accepted.",
  "schema": "steps",
  "input": [
    {
      "id": "s1",
      "op": "share",
      "inputs": {
        "numerator": {
          "id": "spec_4b1f0c2d9e8a7b6c5d4e3f2a1b0c9d8e",
          "content_version": "cv_0f1e2d3c4b5a69788796a5b4c3d2e1f0",
          "label": "Gross ODA disbursements"
        },
        "denominator": {
          "id": "ops_3c9e1f7a2b8d4e6f",
          "content_version": "ocv_8d2a6f1c9e3b7a5d",
          "label": "Total ODA"
        }
      },
      "policy": "share_of_intersect_periods",
      "period_coverage": [
        {
          "period": "2024",
          "entities": 31
        }
      ],
      "unit": {
        "ref": "Percent",
        "label": "per cent"
      }
    }
  ],
  "expect": "accept"
}
